{
  "contract": "engineering-history.v1",
  "operation": "document.render",
  "client_event_key": "synthetic-document",
  "expected_head": "77e4c627ab443eb2be2b2f08ad0457669eaec3d257866a7c3078f8b7308b5928",
  "source": {
    "kind": "imported",
    "namespace": "synthetic_fixture",
    "id": "local-foundation-example"
  },
  "occurred_at": null,
  "body": {
    "work_item_id": "wrk_aaaaaaaaaaaaaaaaaaaaaaaaaaaaaaaa",
    "work_revision_sha256": "77e4c627ab443eb2be2b2f08ad0457669eaec3d257866a7c3078f8b7308b5928",
    "document_id": "doc_bbbbbbbbbbbbbbbbbbbbbbbbbbbbbbbb",
    "document_version": 1,
    "document_type": "review",
    "supersedes_document_sha256": null,
    "fields": {
      "denied_paths": "unknown — synthetic example, no evidence collected",
      "problem": "unknown — synthetic example, no evidence collected",
      "allowed_paths": "unknown — synthetic example, no evidence collected",
      "title": "Synthetic review; no approval",
      "worker_limits": "unknown — synthetic example, no evidence collected",
      "merge_deployment_and_further_paid_runs": "unknown — synthetic example, no evidence collected",
      "alternatives": "unknown — synthetic example, no evidence collected",
      "dependencies": "unknown — synthetic example, no evidence collected",
      "open_decisions": "unknown — synthetic example, no evidence collected",
      "baseline": "unknown — synthetic example, no evidence collected",
      "risks": "unknown — synthetic example, no evidence collected",
      "validation_limits": "unknown — synthetic example, no evidence collected",
      "request_source": "unknown — synthetic example, no evidence collected",
      "expected_behavior": "unknown — synthetic example, no evidence collected",
      "assumptions": "unknown — synthetic example, no evidence collected",
      "starting_state": "unknown — synthetic example, no evidence collected",
      "capture_operation_id": "unknown — synthetic example, no evidence collected",
      "claim_or_field_to_source_reference_table": "unknown — synthetic example, no evidence collected",
      "acceptance_criteria": "unknown — synthetic example, no evidence collected",
      "validation_mapping": "unknown — synthetic example, no evidence collected",
      "exact_action_or_recording_only": "Recording only; no managed execution grant",
      "unknowns": "unknown — synthetic example, no evidence collected",
      "validation_limits_of_inference": "unknown — synthetic example, no evidence collected",
      "constraints": "unknown — synthetic example, no evidence collected",
      "interactive_or_managed_context": "unknown — synthetic example, no evidence collected",
      "registration_status": "unknown — synthetic example, no evidence collected",
      "interactive_recording_or_managed_execution": "unknown — synthetic example, no evidence collected",
      "approach": "unknown — synthetic example, no evidence collected",
      "revision_relationship": "unknown — synthetic example, no evidence collected",
      "spending_controls": "unknown — synthetic example, no evidence collected",
      "recipe": "unknown — synthetic example, no evidence collected",
      "protected_session_refs": "unknown — synthetic example, no evidence collected",
      "rationale_and_source": "unknown — synthetic example, no evidence collected",
      "non_goals": "unknown — synthetic example, no evidence collected"
    },
    "references": []
  }
}
